post_id,comment_id,source,labels,text_orig,text,keywords
post068,c079,2,{'protocol'},Try changing VPN servers or use a stealth VPN protocol to avoid location detection.,change vpn servers use stealth vpn vpn protocol avoid,"{'protocol', 'use', 'change', 'servers', 'avoid', 'stealth', 'vpn'}"
post068,c080,2,{'protocol'},Some games use GPS or system location settings; make sure those are disabled or set to match the VPN.,use gps location set match vpn gps location settings,"{'gps', 'location', 'use', 'match', 'set', 'vpn', 'settings'}"
post068,c081,2,"{'protocol', 'device'}",I had to switch to a dedicated gaming VPN to bypass these checks.,vpn bypass check dedicate game vpn,"{'dedicate', 'game', 'bypass', 'vpn', 'check'}"
post069,c082,2,set(),Check for outdated Wi-Fi adapters or interference; also verify device settings and firmware updates.,adapters interference verify check outdated wifi,"{'outdated', 'wifi', 'verify', 'adapters', 'interference', 'check'}"
post069,c083,2,set(),Sometimes older devices can’t handle newer Wi-Fi standards; try resetting network settings on slow devices.,newer wifi standards settings slow devices,"{'slow', 'wifi', 'standards', 'devices', 'settings', 'newer'}"
post069,c084,2,set(),I also noticed that some apps run updates in background which slow down speed on some devices.,update background slow apps run update background slow speed,"{'slow', 'apps', 'run', 'speed', 'background', 'update'}"
post070,c085,2,"{'protocol', 'device'}",This might be due to VPN server overload or unstable internet; try switching servers or protocols.,vpn server overload overload unstable internet,"{'internet', 'overload', 'unstable', 'server', 'vpn'}"
post070,c086,2,{'protocol'},Check if your ISP throttles VPN traffic; a different VPN provider or protocol might help.,throttle vpn traffic vpn traffic different check isp throttle,"{'different', 'isp', 'throttle', 'traffic', 'vpn', 'check'}"
post070,c087,2,{'protocol'},I found that switching from UDP to TCP protocol on my VPN helped stabilize video calls.,switch udp tcp tcp protocol vpn vpn help stabilize,"{'protocol', 'stabilize', 'udp', 'tcp', 'vpn', 'switch', 'help'}"
post071,c088,2,set(),Strong signal doesn’t always mean good speed. Check for network congestion or ISP throttling.,congestion isp throttle strong signal doesnt,"{'signal', 'congestion', 'isp', 'strong', 'throttle', 'doesnt'}"
post071,c089,2,{'network_concept'},I didn’t realize others were using heavy bandwidth on my network until I limited devices.,bandwidth network limit heavy bandwidth network,"{'heavy', 'network', 'bandwidth', 'limit'}"
post072,c090,2,{'protocol'},Your VPN might be connected but missing the right routes or permissions for internal network access.,vpn connect miss permissions internal network,"{'internal', 'miss', 'network', 'permissions', 'connect', 'vpn'}"
post072,c091,2,{'protocol'},I contacted IT and they had to push updated VPN configs to fix the routing.,contact push update update vpn configs,"{'contact', 'push', 'configs', 'update', 'vpn'}"
post073,c092,2,"{'tool', 'network_concept'}",Ping only measures latency; packet loss or jitter can still cause lag despite low ping.,ping measure latency latency packet loss despite low ping jitter cause lag,"{'packet', 'despite', 'latency', 'measure', 'lag', 'loss', 'low', 'ping', 'jitter', 'cause'}"
post073,c093,2,{'protocol'},"Switching VPN servers helped reduce packet loss, improving my gameplay.",switch vpn servers packet loss improve,"{'packet', 'servers', 'improve', 'loss', 'vpn', 'switch'}"
post074,c094,2,set(),Hotels often limit session length or number of devices; ask front desk if there’s a time limit.,hotels limit session session length number,"{'hotels', 'session', 'length', 'limit', 'number'}"
post074,c095,2,set(),I found that signing in again helped temporarily but it’s annoying for longer work sessions.,sign help temporarily longer work sessions temporarily annoy longer,"{'longer', 'sessions', 'sign', 'annoy', 'work', 'temporarily', 'help'}"
post075,c096,2,"{'protocol', 'device'}",VPN encryption and routing can slow speeds; try a closer VPN server or a faster protocol.,closer vpn server encryption rout slow,"{'slow', 'closer', 'rout', 'encryption', 'server', 'vpn'}"
post075,c097,2,set(),Switching to WireGuard protocol gave me a noticeable speed boost.,wireguard protocol noticeable,"{'protocol', 'wireguard', 'noticeable'}"
post076,c098,2,set(),Check your phone’s power-saving settings; some disable Wi-Fi when the screen is off.,settings disable wifi phone powersaving settings,"{'powersaving', 'wifi', 'disable', 'phone', 'settings'}"
post076,c099,2,set(),Turning off battery optimization for Wi-Fi fixed the problem for me.,battery optimization wifi wifi fix problem,"{'battery', 'problem', 'wifi', 'fix', 'optimization'}"
post077,c100,2,"{'protocol', 'malware'}",Streaming and gaming services often blacklist known VPN IPs. Try switching servers frequently.,blacklist know vpn game service blacklist ips try switch,"{'service', 'game', 'try', 'know', 'ips', 'blacklist', 'vpn', 'switch'}"
post077,c101,2,{'protocol'},I had to subscribe to a premium VPN that specifically supports streaming.,subscribe premium vpn specifically support stream premium vpn specifically,"{'subscribe', 'premium', 'specifically', 'stream', 'vpn', 'support'}"
post078,c102,2,{'network_concept'},Strong Wi-Fi signal doesn’t always mean good internet speed; check for ISP issues or bandwidth hogs.,strong wifi signal isp issue bandwidth internet speed check,"{'signal', 'strong', 'wifi', 'isp', 'bandwidth', 'internet', 'speed', 'issue', 'check'}"
post078,c103,2,{'device'},"After rebooting my modem, the speed improved significantly.",modem speed improve reboot modem speed,"{'speed', 'improve', 'reboot', 'modem'}"
post079,c104,2,set(),Many hotel networks use captive portals that require re-authentication after disconnection.,portals require reauthentication require reauthentication disconnection captive portals require,"{'portals', 'captive', 'disconnection', 'reauthentication', 'require'}"
post079,c105,2,set(),I started using a hotspot device to avoid the hassle.,use hotspot device hotspot device avoid,"{'use', 'hotspot', 'avoid', 'device'}"
post080,c106,2,"{'protocol', 'device', 'time'}",VPN servers can get congested during peak times; try connecting outside peak hours or use a different server.,vpn servers congest peak time try peak hours,"{'congest', 'hours', 'servers', 'try', 'vpn', 'peak', 'time'}"
post080,c107,2,"{'protocol', 'device'}",Switching to a dedicated VPN server improved my stability.,dedicate vpn server,"{'server', 'vpn', 'dedicate'}"
post081,c108,2,{'protocol'},"VPN servers can get overloaded, causing slowdowns. Try switching servers or a different VPN provider.",servers different vpn different vpn provider,"{'vpn', 'provider', 'servers', 'different'}"
post081,c109,2,{'device'},"Changing to a nearby server helped, but some streams still drop quality occasionally.",server help stream stream drop quality change nearby server,"{'change', 'drop', 'stream', 'quality', 'server', 'nearby', 'help'}"
post082,c110,2,{'protocol'},Sounds like a permissions or DNS resolution issue inside the VPN; check with your IT team.,inside vpn check permissions dns resolution,"{'inside', 'resolution', 'permissions', 'dns', 'vpn', 'check'}"
post082,c111,2,"{'protocol', 'device'}","They had to push a DNS update to my laptop, after which everything worked fine.",update laptop work dns update laptop push dns update,"{'push', 'dns', 'update', 'work', 'laptop'}"
post083,c112,2,"{'org', 'cardinal'}",Phones sometimes connect to 2.4GHz even if 5GHz is available; try forgetting and reconnecting to the right band.,phone connect 4ghz reconnecting right band 5ghz available try,"{'reconnecting', 'right', 'try', 'available', 'connect', '5ghz', '4ghz', 'phone', 'band'}"
post083,c113,2,{'cardinal'},Switching to 5GHz fixed the speed issues completely.,switch 5ghz fix,"{'fix', '5ghz', 'switch'}"
post084,c114,2,"{'protocol', 'device'}",VPN instability can be caused by poor network or aggressive firewall settings.,vpn instability cause aggressive firewall settings,"{'aggressive', 'instability', 'firewall', 'vpn', 'cause', 'settings'}"
post084,c115,2,"{'protocol', 'device'}",Disabling some firewall rules and changing VPN protocols helped me stay connected.,change vpn protocols disable firewall rule,"{'change', 'rule', 'firewall', 'disable', 'protocols', 'vpn'}"
post085,c116,2,"{'protocol', 'network_concept'}",Latency spikes often mean jitter or packet loss; VPN routing may be unstable.,vpn rout unstable latency spike mean jitter packet loss,"{'packet', 'latency', 'rout', 'mean', 'loss', 'unstable', 'spike', 'vpn', 'jitter'}"
post085,c117,2,"{'protocol', 'device'}",Switching to a different VPN server improved the consistency.,different vpn server,"{'server', 'vpn', 'different'}"
post086,c118,2,set(),Power management settings might be turning off your Wi-Fi adapter when sleeping.,wifi adapter sleep power management settings settings turn wifi,"{'management', 'wifi', 'turn', 'sleep', 'adapter', 'power', 'settings'}"
post086,c119,2,set(),I disabled power saving on the Wi-Fi card and it fixed the issue.,disable power save power save wifi save wifi card,"{'save', 'wifi', 'disable', 'card', 'power'}"
post087,c120,2,set(),Many hotel Wi-Fi networks have session time limits or device limits.,network session time wifi network session hotel wifi network,"{'session', 'wifi', 'network', 'hotel', 'time'}"
post087,c121,2,set(),Using a personal hotspot solved my connectivity headaches.,hotspot solve connectivity personal hotspot solve,"{'solve', 'personal', 'hotspot', 'connectivity'}"
post088,c122,2,"{'protocol', 'device'}",VPN server overload during peak times is common; switching servers or times might help.,switch servers time vpn server overload overload peak time,"{'servers', 'switch', 'overload', 'server', 'vpn', 'peak', 'time'}"
post088,c123,2,"{'protocol', 'device'}",Switching to a less popular server made my VPN usable again.,make vpn usable switch popular server,"{'popular', 'usable', 'vpn', 'server', 'make', 'switch'}"
post089,c124,2,{'network_concept'},Check if other devices are using lots of bandwidth or if your ISP is having issues.,bandwidth isp issue,"{'isp', 'issue', 'bandwidth'}"
post089,c125,2,{'device'},Rebooting the router cleared the slow loading for me.,reboot router clear router clear slow,"{'clear', 'slow', 'reboot', 'router'}"
post090,c126,2,"{'protocol', 'malware'}",Streaming platforms often block known VPN IPs; try rotating servers or premium VPNs.,vpn ips try block know vpn servers premium vpns,"{'premium', 'vpns', 'servers', 'try', 'know', 'ips', 'vpn', 'block'}"
post090,c127,2,{'protocol'},Upgrading to a streaming-optimized VPN fixed the issue.,upgrade streamingoptimized vpn streamingoptimized vpn fix vpn fix issue,"{'streamingoptimized', 'issue', 'fix', 'vpn', 'upgrade'}"
post098,c141,2,set(),Try uninstalling the driver completely and reinstalling an older stable version.,uninstalling driver completely,"{'completely', 'uninstalling', 'driver'}"
post098,c142,2,set(),"Reverting to the old driver solved the disconnects, thanks!",driver solve disconnect revert old driver,"{'solve', 'revert', 'disconnect', 'old', 'driver'}"
post099,c143,2,set(),Sometimes new drivers have bugs; check for patches or rollback.,drivers bug check check patch rollback,"{'patch', 'bug', 'rollback', 'drivers', 'check'}"
post099,c144,2,set(),Rolled back the driver and speeds are back to normal.,driver speed normal,"{'normal', 'driver', 'speed'}"
post100,c145,2,set(),Try disabling power saving options in the driver settings.,disable power save,"{'disable', 'power', 'save'}"
post100,c146,2,{'tool'},Disabling power saving helped reduce the ping spikes. Thanks!,reduce ping spike disable power save,"{'save', 'disable', 'reduce', 'ping', 'spike', 'power'}"
post101,c147,2,{'configuration_setting'},Check your network driver’s QoS settings; sometimes they get reset.,drivers qos settings,"{'drivers', 'settings', 'qos'}"
post101,c148,2,{'configuration_setting'},Adjusting QoS settings fixed the buffering problems.,adjust qos settings settings fix buffer fix buffer problems,"{'problems', 'qos', 'adjust', 'fix', 'settings', 'buffer'}"
post102,c149,2,{'protocol'},Check if the new driver has compatibility issues with VPN protocols.,driver compatibility issue issue vpn protocols,"{'compatibility', 'issue', 'protocols', 'vpn', 'driver'}"
post102,c150,2,{'protocol'},Switching back to the previous driver restored VPN connectivity.,restore vpn connectivity previous driver restore,"{'connectivity', 'restore', 'previous', 'vpn', 'driver'}"
post103,c151,2,set(),Try resetting the network adapter and forget/reconnect the Wi-Fi network.,try reset network network adapter forgetreconnect,"{'reset', 'network', 'try', 'adapter', 'forgetreconnect'}"
post103,c152,2,set(),Resetting fixed the auto reconnect issue.,auto reconnect issue,"{'issue', 'auto', 'reconnect'}"
post104,c153,2,set(),Check if network discovery and file sharing settings got disabled after the update.,check network discovery settings disable update network discovery file,"{'network', 'disable', 'discovery', 'update', 'settings', 'file', 'check'}"
post104,c154,2,{'network_concept'},Re-enabling those settings restored LAN sharing.,settings restore lan reenabling settings restore,"{'lan', 'restore', 'settings', 'reenabling'}"
post105,c155,2,{'protocol'},Try flushing DNS and resetting TCP/IP stack after updating drivers.,flush dns reset reset tcpip stack dns reset tcpip,"{'stack', 'reset', 'tcpip', 'dns', 'flush'}"
post105,c156,2,{'protocol'},Flushing DNS and resetting fixed the connectivity issue.,flush dns reset reset fix connectivity,"{'connectivity', 'reset', 'dns', 'fix', 'flush'}"
post106,c157,2,set(),Packet loss can be driver-related; try disabling advanced features like Large Send Offload.,packet loss driverrelated large send offload,"{'packet', 'offload', 'loss', 'large', 'driverrelated', 'send'}"
post106,c158,2,set(),Disabling that feature stopped the packet loss. Thanks!,feature stop packet packet loss thank,"{'packet', 'feature', 'stop', 'thank', 'loss'}"
post107,c159,2,set(),Check if the update disabled the hosted network feature in the driver.,check update disable disable host network network feature driver,"{'network', 'feature', 'disable', 'update', 'driver', 'host', 'check'}"
post107,c160,2,set(),Enabling hosted network in driver properties fixed the hotspot.,properties fix hotspot network driver properties enable host network,"{'network', 'hotspot', 'enable', 'properties', 'fix', 'driver', 'host'}"
