post_id,comment_id,source,labels,text_orig,text,keywords
post075,,1,{'protocol'},"My local Wi-Fi speed is good, but when I connect to VPN, internet speed drops significantly.",connect vpn internet local wifi speed internet speed drop,"{'wifi', 'internet', 'local', 'speed', 'drop', 'connect', 'vpn'}"
post076,,0,set(),Wi-Fi disconnects when phone goes to sleep,disconnect phone sleep,"{'sleep', 'phone', 'disconnect'}"
post076,,1,set(),"My phone loses Wi-Fi connection after it sleeps, which interrupts my downloads and streaming.",connection sleep interrupt interrupt download stream phone lose wifi,"{'interrupt', 'connection', 'wifi', 'stream', 'lose', 'sleep', 'phone', 'download'}"
post077,,0,{'protocol'},VPN connected but geo-blocked content still unavailable,connect geoblocked content geoblocked content unavailable,"{'content', 'geoblocked', 'connect', 'unavailable'}"
post077,,1,{'protocol'},"Even with VPN active, I can’t access some geo-restricted games or videos.",access georestricted game vpn active access,"{'georestricted', 'access', 'game', 'active', 'vpn'}"
post078,,0,set(),Wi-Fi signal strong but pages load slowly,signal strong page page load slowly,"{'signal', 'strong', 'slowly', 'load', 'page'}"
post078,,1,set(),"My Wi-Fi signal strength is great, but websites and apps take forever to load.",wifi signal strength websites apps forever,"{'signal', 'forever', 'apps', 'wifi', 'websites', 'strength'}"
post079,,0,{'person'},Hotel Wi-Fi requires login every time I reconnect,hotel wifi require login time reconnect,"{'wifi', 'login', 'require', 'reconnect', 'hotel', 'time'}"
post079,,1,set(),"Every time I leave and come back to the hotel Wi-Fi, it asks me to log in again, which is annoying.",come hotel wifi hotel wifi ask ask log annoy,"{'come', 'wifi', 'annoy', 'ask', 'hotel', 'log'}"
post080,,0,"{'protocol', 'time'}",VPN connection is slow and unstable during work hours,connection slow unstable unstable work hours,"{'slow', 'connection', 'hours', 'unstable', 'work'}"
post080,,1,"{'protocol', 'time'}",My VPN is slow and keeps disconnecting during peak hours at work.,slow disconnect peak vpn slow disconnect disconnect peak hours,"{'slow', 'hours', 'disconnect', 'vpn', 'peak'}"
post081,,0,{'protocol'},VPN connected but streaming videos buffer frequently,connect stream videos videos buffer frequently,"{'videos', 'frequently', 'stream', 'connect', 'buffer'}"
post081,,1,{'protocol'},"Even though my VPN shows connected, streaming services keep buffering or lower quality automatically.",connect stream service buffer lower quality,"{'lower', 'service', 'stream', 'connect', 'quality', 'buffer'}"
post082,,0,"{'protocol', 'malware'}",Company VPN connects but no access to internal email,company vpn connect access internal email,"{'internal', 'access', 'company', 'connect', 'email', 'vpn'}"
post082,,1,{'protocol'},VPN says connected but I can’t open internal emails or shared drives at all.,internal email share vpn say connect,"{'internal', 'say', 'connect', 'share', 'email', 'vpn'}"
post083,,0,set(),Wi-Fi signal strong but slow internet on phone,strong slow internet signal strong slow,"{'strong', 'slow', 'signal', 'internet'}"
post083,,1,set(),My phone shows strong Wi-Fi bars but loading apps and webpages is slow and laggy.,webpages slow laggy strong wifi bar,"{'slow', 'webpages', 'strong', 'wifi', 'bar', 'laggy'}"
post084,,0,{'protocol'},VPN disconnects frequently during coding sessions,disconnect frequently cod,"{'cod', 'disconnect', 'frequently'}"
post084,,1,"{'protocol', 'date'}","My VPN drops out multiple times during the day, interrupting my work.",vpn drop multiple day interrupt work,"{'day', 'multiple', 'drop', 'work', 'vpn', 'interrupt'}"
post085,,0,"{'protocol', 'tool', 'network_concept'}",VPN causes high ping spikes despite low average latency,cause high ping ping spike despite,"{'high', 'despite', 'ping', 'spike', 'cause'}"
post085,,1,{'tool'},"While my ping averages are low, I experience sudden spikes that lag my games.",sudden spike lag ping average low,"{'sudden', 'average', 'lag', 'low', 'ping', 'spike'}"
post086,,0,{'device'},Wi-Fi disconnects when laptop goes to sleep,disconnect laptop sleep,"{'sleep', 'laptop', 'disconnect'}"
post086,,1,{'device'},"My laptop loses Wi-Fi connection whenever it sleeps, causing dropouts in downloads.",wifi connection sleep lose wifi connection cause dropouts download,"{'connection', 'download', 'dropouts', 'wifi', 'lose', 'sleep', 'cause'}"
post087,,0,{'person'},Hotel Wi-Fi keeps logging me out repeatedly,wifi log repeatedly hotel wifi log,"{'wifi', 'hotel', 'log', 'repeatedly'}"
post087,,1,set(),I keep getting kicked off the hotel Wi-Fi and have to log in again multiple times a day.,wifi log multiple kick hotel wifi,"{'wifi', 'multiple', 'kick', 'hotel', 'log'}"
post088,,0,"{'protocol', 'time'}",VPN slows down during afternoon work hours,slow afternoon work vpn slow afternoon afternoon work hours,"{'slow', 'afternoon', 'hours', 'work', 'vpn'}"
post088,,1,"{'protocol', 'time'}","VPN speeds drop drastically during afternoon peak hours, affecting my productivity.",speed drop drastically hours affect productivity,"{'productivity', 'hours', 'affect', 'speed', 'drop', 'drastically'}"
post089,,0,set(),Websites slow despite full Wi-Fi bars,websites slow despite slow despite wifi despite wifi bar,"{'slow', 'despite', 'bar', 'wifi', 'websites'}"
post089,,1,set(),Wi-Fi shows full signal but webpages and apps load painfully slow.,signal webpages apps,"{'signal', 'webpages', 'apps'}"
post090,,0,{'protocol'},VPN connected but geo-restricted content still blocked,connect georestricted content vpn connect georestricted,"{'content', 'georestricted', 'connect', 'vpn'}"
post090,,1,{'protocol'},"I use VPN to access foreign streaming, but content stays blocked or shows error.",access foreign stream vpn access foreign,"{'vpn', 'stream', 'access', 'foreign'}"
post098,,0,set(),Network driver update causes frequent disconnections,cause frequent disconnections network driver update,"{'network', 'frequent', 'disconnections', 'update', 'driver', 'cause'}"
post098,,1,{'time'},"Since updating my Ethernet driver, my connection drops every few minutes.",ethernet driver connection update ethernet driver,"{'update', 'connection', 'driver', 'ethernet'}"
post099,,0,set(),Wi-Fi driver update causes slow upload speeds,wifi driver update cause slow upload,"{'slow', 'wifi', 'upload', 'update', 'driver', 'cause'}"
post099,,1,set(),"After updating my wireless driver, my upload speeds dropped significantly.",wireless driver upload update wireless driver driver upload speed,"{'wireless', 'upload', 'speed', 'update', 'driver'}"
post100,,0,{'tool'},"After network driver update, ping spikes in games",driver update ping update ping spike,"{'ping', 'update', 'spike', 'driver'}"
post100,,1,{'tool'},"Ever since I updated my network adapter driver, my ping spikes randomly during online gaming.",adapter driver ping ping spike randomly,"{'randomly', 'ping', 'adapter', 'spike', 'driver'}"
post101,,0,set(),Network driver update causes video buffering issues,network driver update cause video buffer,"{'network', 'video', 'update', 'driver', 'cause', 'buffer'}"
post101,,1,set(),Video streams keep buffering after I installed the latest Wi-Fi driver.,stream buffer instal video stream buffer latest wifi driver,"{'wifi', 'instal', 'video', 'stream', 'latest', 'driver', 'buffer'}"
post102,,0,{'protocol'},Network driver update disables VPN connections,disable vpn connections driver update disable,"{'connections', 'disable', 'update', 'vpn', 'driver'}"
post102,,1,{'protocol'},"After updating my network driver, I can't connect to VPN anymore.",network driver connect connect vpn anymore,"{'network', 'anymore', 'connect', 'vpn', 'driver'}"
post103,,0,set(),Wi-Fi driver update prevents auto reconnect,prevent auto reconnect driver update prevent,"{'prevent', 'auto', 'reconnect', 'update', 'driver'}"
post103,,1,{'device'},My laptop doesn't auto reconnect to saved Wi-Fi networks after updating the driver.,auto reconnect save reconnect save wifi doesnt auto reconnect,"{'save', 'wifi', 'auto', 'doesnt', 'reconnect'}"
post104,,0,{'network_concept'},Ethernet driver update disables LAN sharing,driver update disable update disable lan ethernet driver update,"{'lan', 'disable', 'update', 'driver', 'ethernet'}"
post104,,1,{'network_concept'},"Since updating my Ethernet driver, my PC can't share files over LAN.",update ethernet driver share file lan ethernet driver pc,"{'pc', 'lan', 'update', 'share', 'driver', 'file', 'ethernet'}"
post105,,0,set(),Network driver update causes limited connectivity,network driver update cause limit connectivity,"{'connectivity', 'network', 'limit', 'update', 'driver', 'cause'}"
post105,,1,set(),"After a network driver update, I get ‘limited connectivity’ on Wi-Fi.",update limit connectivity network driver update,"{'connectivity', 'network', 'limit', 'update', 'driver'}"
post106,,0,set(),New network driver causes packet loss during streaming,network driver cause packet loss stream driver cause packet,"{'packet', 'network', 'loss', 'stream', 'driver', 'cause'}"
post106,,1,set(),"Since updating my network adapter driver, I experience packet loss when streaming.",driver experience packet adapter driver experience network adapter driver,"{'packet', 'experience', 'network', 'adapter', 'driver'}"
post107,,0,set(),Network driver update breaks hotspot functionality,break hotspot functionality network driver update,"{'break', 'functionality', 'network', 'hotspot', 'update', 'driver'}"
post107,,1,set(),"After updating my Wi-Fi driver, my PC hotspot feature stopped working.",hotspot feature stop pc hotspot feature update wifi driver,"{'wifi', 'feature', 'hotspot', 'stop', 'update', 'pc', 'driver'}"
post001,c001,2,set(),VPNs often cause issues with specific sites. Try turning it off and check again.,vpns cause issue try turn check issue specific sit,"{'sit', 'specific', 'vpns', 'try', 'turn', 'issue', 'cause', 'check'}"
post001,c002,2,set(),Sometimes browser cache or cookies cause loading issues. Clear those and retry.,cache cookies cause browser cache cookies,"{'browser', 'cause', 'cookies', 'cache'}"
post002,c003,2,{'device'},Your router might be too far or there could be walls blocking the signal. Consider adding a repeater or relocating the router.,repeater relocate router router far wall wall block signal,"{'signal', 'wall', 'repeater', 'router', 'far', 'block', 'relocate'}"
post003,c004,2,"{'protocol', 'ip_address', 'ip', 'network_concept'}",Sounds like DNS problems. Try switching your DNS server to 8.8.8.8 or 1.1.1.1.,try switch dns like dns problems,"{'like', 'try', 'dns', 'problems', 'switch'}"
post004,c005,2,{'protocol'},This often happens because of IP conflicts or DNS issues. Try reconnecting to the network.,conflict dns issue,"{'issue', 'dns', 'conflict'}"
post004,c006,2,"{'device', 'network_concept'}",Could also be a MAC address filter or router blocking the device.,filter router block address filter router,"{'filter', 'address', 'block', 'router'}"
post005,c007,2,{'device'},Physical obstacles or distance to router can degrade signal. Try moving back or using a repeater.,obstacles distance router distance router degrade,"{'degrade', 'router', 'distance', 'obstacles'}"
post005,c008,2,set(),Also check for interference from nearby devices like microwaves or cordless phones.,interference nearby devices,"{'devices', 'interference', 'nearby'}"
post006,c009,2,"{'protocol', 'device'}",Check router DHCP settings or possible MAC filtering.,router dhcp settings dhcp settings possible,"{'possible', 'dhcp', 'settings', 'router'}"
post006,c010,2,set(),"Sometimes routers have guest Wi-Fi isolation enabled, blocking internet.",wifi isolation enable guest wifi isolation routers guest wifi,"{'wifi', 'routers', 'enable', 'isolation', 'guest'}"
post007,c011,2,"{'protocol', 'device'}","Try changing the VPN server or protocol, sometimes overloaded servers cause drops.",servers cause drop change vpn server,"{'change', 'servers', 'drop', 'server', 'vpn', 'cause'}"
post007,c012,2,"{'protocol', 'device'}",Check if your firewall or antivirus is interfering with VPN connections.,firewall antivirus interfere interfere vpn connections,"{'antivirus', 'interfere', 'connections', 'firewall', 'vpn'}"
post008,c013,2,{'device'},Check for background updates or malware on your laptop.,background update malware update malware laptop,"{'update', 'laptop', 'malware', 'background'}"
post008,c014,2,set(),Try updating your network adapter drivers or resetting network settings.,try update network reset network settings,"{'reset', 'network', 'try', 'update', 'settings'}"
post009,c015,2,"{'protocol', 'device', 'network_concept'}",Could be an ISP outage or DNS server issue. Try switching DNS or restarting the router.,outage dns server,"{'dns', 'server', 'outage'}"
post010,c016,2,"{'protocol', 'device'}",You might need to connect via VPN or check if firewall rules block access.,check firewall rule connect vpn check,"{'rule', 'firewall', 'connect', 'vpn', 'check'}"
post011,c017,2,{'protocol'},Maybe network congestion or DNS resolution issues for those specific domains.,congestion dns resolution issue specific domains,"{'specific', 'congestion', 'domains', 'resolution', 'issue', 'dns'}"
post012,c018,2,{'configuration_setting'},Could be unstable Wi-Fi or MTU size issues. Try using wired connection.,unstable wifi mtu mtu size issue,"{'wifi', 'mtu', 'size', 'unstable', 'issue'}"
post013,c019,2,set(),Wi-Fi interference or poor signal can cause audio problems. Try switching bands or moving closer.,interference poor signal signal cause audio,"{'signal', 'audio', 'poor', 'interference', 'cause'}"
post014,c020,2,{'device'},Physical obstacles or distance to router can degrade signal. Try moving back or using a repeater.,obstacles distance router distance router degrade,"{'degrade', 'router', 'distance', 'obstacles'}"
post014,c021,2,set(),Also check for interference from nearby devices like microwaves or cordless phones.,interference nearby devices,"{'devices', 'interference', 'nearby'}"
post015,c022,2,{'protocol'},Try reconnecting the VPN or check your VPN profile and permissions.,try reconnecting vpn check vpn profile,"{'reconnecting', 'try', 'profile', 'vpn', 'check'}"
post016,c023,2,set(),Overheating or firmware bugs could cause this. Check logs and update firmware.,overheat firmware bug log update firmware,"{'log', 'firmware', 'bug', 'update', 'overheat'}"
post017,c024,2,set(),Network congestion or ISP throttling during peak hours.,congestion isp throttle throttle peak hours,"{'congestion', 'isp', 'hours', 'throttle', 'peak'}"
post018,c025,2,{'device'},Campus firewall might be blocking those domains.,firewall block domains campus firewall block,"{'domains', 'firewall', 'block', 'campus'}"
post019,c026,2,{'network_concept'},"Repeaters halve the bandwidth, consider upgrading to mesh Wi-Fi.",repeaters halve bandwidth upgrade mesh wifi,"{'wifi', 'bandwidth', 'repeaters', 'mesh', 'halve', 'upgrade'}"
post020,c027,2,{'device'},Check if network discovery is enabled and firewall settings.,discovery enable firewall enable firewall settings,"{'discovery', 'enable', 'settings', 'firewall'}"
post021,c028,2,"{'protocol', 'device'}",Check router DHCP settings or possible MAC filtering.,router dhcp settings dhcp settings possible,"{'possible', 'dhcp', 'settings', 'router'}"
post021,c029,2,set(),"Sometimes routers have guest Wi-Fi isolation enabled, blocking internet.",wifi isolation enable guest wifi isolation routers guest wifi,"{'wifi', 'routers', 'enable', 'isolation', 'guest'}"
post022,c030,2,set(),"Check for interference, overloaded network, or use wired connection.",interference overload network network use wire,"{'wire', 'use', 'network', 'overload', 'interference'}"
post023,c031,2,"{'protocol', 'device', 'malware'}",Email server might require VPN for remote access.,require vpn remote,"{'remote', 'vpn', 'require'}"
post024,c032,2,{'cardinal'},Microwaves cause 2.4GHz interference. Use 5GHz band if possible.,cause 4ghz interference microwave cause 4ghz,"{'microwave', 'interference', 'cause', '4ghz'}"
post025,c033,2,"{'protocol', 'device'}",VPN server load or encryption overhead could be the cause.,server load encryption encryption overhead cause,"{'encryption', 'overhead', 'load', 'server', 'cause'}"
post026,c034,2,{'device'},Wi-Fi isolation or different subnets can prevent printer discovery.,prevent printer discovery isolation different subnets,"{'subnets', 'different', 'prevent', 'discovery', 'isolation', 'printer'}"
post027,c035,2,{'protocol'},Dorm Wi-Fi might block certain sites or require VPN.,wifi block certain sit require vpn dorm wifi block,"{'sit', 'wifi', 'certain', 'dorm', 'vpn', 'block', 'require'}"
post028,c036,2,{'network_concept'},Too many devices can saturate the network bandwidth.,saturate network bandwidth devices saturate network,"{'network', 'devices', 'bandwidth', 'saturate'}"
post029,c037,2,"{'protocol', 'cardinal'}",Try using VPN over port 443 or a different VPN protocol.,port 443 different try use vpn,"{'different', 'use', 'try', '443', 'vpn', 'port'}"
post030,c038,2,"{'configuration_setting', 'device'}",Could be network congestion or router QoS settings limiting video traffic.,congestion router qos limit video traffic router qos settings,"{'qos', 'router', 'congestion', 'video', 'traffic', 'limit', 'settings'}"
post037,c046,2,"{'protocol', 'tool'}",Check if the Ethernet adapter has a static IP or custom DNS. Also try `ipconfig /release` and `ipconfig /renew` from Command Prompt.,try ipconfig release custom dns try dns try ipconfig,"{'try', 'release', 'custom', 'ipconfig', 'dns'}"
post038,c047,2,set(),Sounds like a background service polling something. Try disabling Windows Update Delivery Optimization and check for Realtek driver issues.,check realtek driver,"{'realtek', 'driver', 'check'}"
post039,c048,2,"{'protocol', 'network_concept'}",Your VPN might be using full tunneling. Check if 'Use default gateway on remote network' is checked in adapter properties.,tunnel check use vpn use tunnel,"{'use', 'vpn', 'tunnel', 'check'}"
post040,c049,2,set(),"Could be packet shaping or NIC driver issue. Try lowering OBS bitrate, and update your Ethernet driver from manufacturer’s site, not Windows Update.",nic driver issue update ethernet driver bitrate update ethernet,"{'bitrate', 'nic', 'issue', 'update', 'driver', 'ethernet'}"
post041,c050,2,"{'protocol', 'ip', 'tool', 'person'}",Try flushing DNS (`ipconfig /flushdns`) and switching to 8.8.8.8. Some antivirus apps also block domains — try disabling temporarily.,domains try disable antivirus apps block try flush dns,"{'antivirus', 'apps', 'domains', 'try', 'disable', 'flush', 'dns', 'block'}"
post042,c051,2,set(),You can clean up ghost network profiles from the registry under `HKEY_LOCAL_MACHINE\SOFTWARE\Microsoft\Windows NT\CurrentVersion\NetworkList\Profiles`.,registry hkey_local_machinesoftwaremicrosoftwindows ntcurrentversionnetworklistprofiles profile registry hkey_local_machinesoftwaremicrosoftwindows,"{'hkey_local_machinesoftwaremicrosoftwindows', 'profile', 'registry', 'ntcurrentversionnetworklistprofiles'}"
post043,c052,2,set(),Sounds like malware or a domain policy. Try checking the 'Internet Settings' in Group Policy Editor and scan with Malwarebytes.,malware domain policy sound like malware check internet settings,"{'policy', 'sound', 'domain', 'like', 'internet', 'malware', 'settings', 'check'}"
post044,c053,2,{'network_concept'},Try forgetting the network and reconnecting. Also check if your MAC address is blocked or if there's a captive portal you’re missing.,theres captive portal try forget network,"{'captive', 'forget', 'network', 'portal', 'theres', 'try'}"
post045,c054,2,set(),Try resetting the Drive app and clearing cached credentials. Also verify that TLS settings are enabled under Internet Options > Advanced.,reset drive app tls settings enable,"{'reset', 'tls', 'drive', 'app', 'enable', 'settings'}"
post046,c055,2,set(),Try disabling 'Allow the computer to turn off this device to save power' in the adapter's power settings. Some drivers bug out after sleep.,settings drivers bug drivers bug sleep power settings drivers,"{'bug', 'sleep', 'drivers', 'power', 'settings'}"
post047,c056,2,"{'protocol', 'network_concept'}",Sounds like a captive portal or IP conflict. Try opening a non-https site or disconnect/reconnect to force login.,nonhttps site disconnectreconnect captive portal ip portal ip conflict,"{'conflict', 'captive', 'portal', 'disconnectreconnect', 'site', 'ip', 'nonhttps'}"
post048,c057,2,{'protocol'},Check your VPN split tunneling settings or confirm your VPN profile permissions.,vpn split tunnel settings confirm vpn vpn profile permissions,"{'confirm', 'tunnel', 'permissions', 'split', 'profile', 'vpn', 'settings'}"
post049,c058,2,{'device'},Sounds like the router placement is poor or there are obstacles. Consider a mesh system or Wi-Fi extender.,mesh wifi extender router placement poor,"{'placement', 'router', 'wifi', 'mesh', 'poor', 'extender'}"
post050,c059,2,"{'protocol', 'device', 'ip'}",Could be DNS or firewall blocking those domains. Try switching to public DNS like 8.8.8.8.,firewall block domains switch public dns domains try switch,"{'domains', 'try', 'firewall', 'public', 'dns', 'block', 'switch'}"
post051,c060,2,"{'protocol', 'network_concept'}",This could be a DHCP issue or IP conflict. Try releasing and renewing your IP.,issue ip conflict dhcp issue ip,"{'issue', 'ip', 'conflict', 'dhcp'}"
post052,c061,2,"{'protocol', 'device'}","Try switching to a different VPN server or protocol, and check for antivirus interference.",different vpn server check antivirus interference,"{'antivirus', 'different', 'interference', 'server', 'vpn', 'check'}"
post053,c062,2,set(),"Look for background updates or malware. Also, update network drivers or reset network settings.",background update malware,"{'update', 'malware', 'background'}"
post054,c063,2,"{'protocol', 'device'}",This might be an ISP issue or DNS misconfiguration. Try rebooting your router or changing DNS servers.,issue dns misconfiguration,"{'issue', 'dns', 'misconfiguration'}"
post055,c064,2,set(),Likely network congestion or ISP throttling during peak times.,congestion isp throttle,"{'isp', 'throttle', 'congestion'}"
post056,c065,2,{'cardinal'},"Try switching between 2.4 GHz and 5 GHz bands, or check for interference.",switch ghz ghz band check interference,"{'ghz', 'switch', 'interference', 'band', 'check'}"
post057,c066,2,"{'protocol', 'device', 'url'}",Try opening a non-https site like http://neverssl.com or manually enter the router IP to trigger the portal.,ip trigger portal manually enter router open nonhttps site,"{'manually', 'router', 'portal', 'trigger', 'open', 'site', 'ip', 'nonhttps', 'enter'}"
post058,c067,2,"{'protocol', 'device'}",Check if your VPN is set to use a far server location or try changing VPN protocol to improve speed.,try change vpn vpn protocol improve change vpn use far server,"{'protocol', 'use', 'change', 'far', 'improve', 'try', 'server', 'vpn'}"
post059,c068,2,{'malware'},Could be interference or network congestion; try switching to a wired connection or different Wi-Fi channel.,interference network congestion connection different wifi different wifi channel,"{'connection', 'different', 'channel', 'congestion', 'wifi', 'network', 'interference'}"
post060,c069,2,"{'protocol', 'device'}",Adjust your power settings to prevent the network adapter from sleeping or check VPN client auto-reconnect options.,adapter sleep check vpn client autoreconnect network adapter sleep power settings prevent,"{'client', 'network', 'prevent', 'power', 'sleep', 'adapter', 'vpn', 'autoreconnect', 'settings', 'check'}"
post061,c070,2,{'protocol'},Try clearing your DNS cache or switching to a different DNS provider like Google DNS.,clear dns cache different dns dns cache switch google dns,"{'clear', 'different', 'google', 'dns', 'switch', 'cache'}"
post062,c071,2,{'protocol'},Check if split tunneling is enabled or if your VPN profile has access rights to internal resources.,split tunnel enable enable vpn profile,"{'tunnel', 'split', 'enable', 'profile', 'vpn'}"
post063,c072,2,set(),Update your Wi-Fi drivers and disable any power-saving features on the wireless adapter.,drivers disable powersaving powersaving feature wireless wifi drivers disable,"{'wireless', 'powersaving', 'wifi', 'feature', 'disable', 'drivers'}"
post064,c073,2,{'device'},"You can use your laptop to create a hotspot after connecting, or request the hotel to allow multiple devices.",create hotspot connect hotspot connect request allow multiple devices,"{'create', 'multiple', 'hotspot', 'devices', 'connect', 'request', 'allow'}"
post065,c074,2,"{'protocol', 'device'}",VPN encryption overhead can slow transfers; try a faster VPN server or adjust transfer protocol settings.,encryption overhead slow faster vpn server,"{'slow', 'encryption', 'overhead', 'server', 'faster', 'vpn'}"
post066,c075,2,"{'protocol', 'device'}",Try renewing your IP lease or rebooting your router; also check if DHCP is enabled on the router.,try renew ip dhcp enable router check dhcp enable lease reboot router,"{'router', 'dhcp', 'try', 'renew', 'enable', 'reboot', 'ip', 'lease', 'check'}"
post067,c076,2,set(),Sometimes hotels offer limited free time; check the Wi-Fi terms or ask the front desk for a paid plan.,hotels offer limit check wifi term,"{'hotels', 'wifi', 'limit', 'offer', 'term', 'check'}"
post067,c077,2,"{'time', 'date'}","I had the same issue last month. The front desk told me the first hour is free, then you need to buy a package.",issue month desk need buy package,"{'desk', 'package', 'month', 'buy', 'issue', 'need'}"
post067,c078,2,set(),"If you need free Wi-Fi for longer, maybe tether from your phone instead, to avoid these extra charges.",free wifi longer tether phone instead,"{'longer', 'wifi', 'instead', 'tether', 'phone', 'free'}"
