post_id,comment_id,source,labels,text_orig,text,keywords
post001,,0,set(),Struggling to log into the train service website,struggle log train train service website,"{'train', 'website', 'service', 'struggle', 'log'}"
post001,,1,"{'protocol', 'date'}","I tried accessing the train login page today but it just kept spinning without ever loading. Strangely, I can browse other websites just fine. I have a VPN running because of work, maybe that’s interfering?",load strangely browse access train login websites fine vpn,"{'train', 'access', 'fine', 'login', 'websites', 'browse', 'load', 'vpn', 'strangely'}"
post002,,0,set(),Wi-Fi signal drops frequently when I move around the house,signal drop frequently,"{'signal', 'drop', 'frequently'}"
post002,,1,set(),"Whenever I go to the basement or the far end of the living room, my Wi-Fi keeps disconnecting or is extremely slow.",disconnect extremely slow wifi disconnect extremely room wifi disconnect,"{'slow', 'wifi', 'disconnect', 'extremely', 'room'}"
post003,,0,{'tool'},Ping is fine but I can't load certain websites or online games,ping fine load websites online game load certain websites,"{'fine', 'websites', 'online', 'game', 'certain', 'load', 'ping'}"
post003,,1,{'tool'},"My ping to the game servers is low and stable, but I can’t load some game features or web pages. Other internet stuff works normally.",ping game servers servers low stable,"{'servers', 'stable', 'game', 'low', 'ping'}"
post004,,0,set(),Phone connected to Wi-Fi but no internet access,connect wifi internet,"{'wifi', 'connect', 'internet'}"
post004,,1,set(),"My phone shows it’s connected to my home Wi-Fi, but when I try to browse or use apps, nothing loads. Other devices on the network work perfectly fine.",wifi try browse connect home wifi,"{'wifi', 'try', 'connect', 'browse', 'home'}"
post005,,0,set(),"After moving office desk, Wi-Fi barely works",desk wifi barely,"{'wifi', 'desk', 'barely'}"
post005,,1,set(),I relocated my desk and suddenly Wi-Fi speed dropped dramatically. Signal strength is weak compared to before.,relocate desk suddenly suddenly wifi speed,"{'desk', 'suddenly', 'wifi', 'speed', 'relocate'}"
post006,,0,set(),"Internet access only works via Ethernet, not Wi-Fi",access work ethernet,"{'work', 'access', 'ethernet'}"
post006,,1,set(),"I can get online when plugged in via cable, but Wi-Fi shows connected without internet.",cable wifi connect online plug cable connect internet,"{'cable', 'wifi', 'plug', 'internet', 'online', 'connect'}"
post007,,0,{'protocol'},VPN disconnects randomly during video calls,disconnect randomly video,"{'video', 'disconnect', 'randomly'}"
post007,,1,"{'protocol', 'time'}","Whenever I join video conferences, my VPN connection drops every 10-15 minutes.",conferences vpn connection,"{'connection', 'vpn', 'conferences'}"
post008,,0,{'device'},Slow internet only on my laptop,slow internet laptop,"{'slow', 'laptop', 'internet'}"
post008,,1,{'device'},"Other devices on my network are fast but my laptop is crawling. Tried restarting, no change.",devices network fast fast laptop crawl network fast laptop,"{'fast', 'crawl', 'network', 'devices', 'laptop'}"
post009,,0,"{'device', 'tool'}",Can ping router but no internet access,router internet access ping router internet,"{'ping', 'access', 'internet', 'router'}"
post009,,1,"{'device', 'tool'}",I can ping my router IP just fine but can’t browse the web or access online services.,ping router ip ip fine browse,"{'fine', 'router', 'browse', 'ping', 'ip'}"
post010,,0,set(),Company intranet not accessible from home,company intranet accessible,"{'accessible', 'intranet', 'company'}"
post010,,1,set(),"I can’t open the company intranet page when working remotely, but the rest of the internet works.",company intranet page remotely rest internet,"{'rest', 'company', 'remotely', 'internet', 'page', 'intranet'}"
post011,,0,{'malware'},Slow loading on university websites,load university websites slow load university,"{'slow', 'websites', 'university', 'load'}"
post011,,1,{'malware'},"University sites load really slow, but other sites are fine.",university sit load really slow sit,"{'sit', 'slow', 'really', 'load', 'university'}"
post012,,0,set(),Uploads to cloud storage fail intermittently,storage fail intermittently upload cloud storage,"{'storage', 'fail', 'upload', 'cloud', 'intermittently'}"
post012,,1,set(),"Sometimes when uploading large files to cloud storage, it just times out after a while.",cloud storage time file cloud storage,"{'cloud', 'storage', 'file', 'time'}"
post013,,0,set(),Can't access video conference audio on Wi-Fi,video conference audio conference audio wifi access video conference,"{'access', 'wifi', 'conference', 'audio', 'video'}"
post013,,1,set(),Video works fine but audio drops out or is distorted when connected to Wi-Fi.,drop distort connect distort connect wifi audio drop distort,"{'wifi', 'audio', 'distort', 'drop', 'connect'}"
post014,,0,set(),"After moving office desk, Wi-Fi barely works",desk wifi barely,"{'wifi', 'desk', 'barely'}"
post014,,1,set(),I relocated my desk and suddenly Wi-Fi speed dropped dramatically. Signal strength is weak compared to before.,relocate desk suddenly suddenly wifi speed,"{'desk', 'suddenly', 'wifi', 'speed', 'relocate'}"
post015,,0,{'protocol'},VPN connected but no access to company servers,connect access company access company servers vpn connect access,"{'access', 'company', 'servers', 'connect', 'vpn'}"
post015,,1,{'protocol'},VPN status shows connected but I can’t reach any internal resources.,status connect reach vpn status connect reach internal resources,"{'internal', 'resources', 'reach', 'connect', 'status', 'vpn'}"
post016,,0,"{'time', 'device'}",Router reboots randomly during peak hours,router reboot randomly reboot randomly peak,"{'randomly', 'reboot', 'peak', 'router'}"
post016,,1,"{'date', 'device'}",My router restarts every day around 5 PM when many people log on.,router restart day people log,"{'restart', 'router', 'day', 'people', 'log'}"
post017,,0,set(),Internet very slow only in evenings,internet slow evenings,"{'evenings', 'slow', 'internet'}"
post017,,1,{'time'},"Speed drops sharply after 7 PM every day, but mornings are fine.",speed drop sharply drop sharply pm mornings fine,"{'fine', 'mornings', 'speed', 'drop', 'sharply', 'pm'}"
post018,,0,set(),Can't open some sites on campus Wi-Fi,open sit campus sit campus wifi,"{'sit', 'open', 'campus', 'wifi'}"
post018,,1,set(),"Certain sites won’t load on campus Wi-Fi, but on my phone’s mobile data they work.",campus wifi phone mobile data work load campus wifi,"{'campus', 'mobile', 'wifi', 'data', 'load', 'work', 'phone'}"
post019,,0,set(),Slow streaming when using repeater,stream use repeater,"{'use', 'stream', 'repeater'}"
post019,,1,{'device'},"Video streaming buffers a lot when connected via repeater, but directly to router it’s fine.",connect repeater directly video stream buffer,"{'repeater', 'video', 'stream', 'connect', 'directly', 'buffer'}"
post020,,0,set(),Wi-Fi connected but no file sharing with coworkers,file share coworkers connect file share,"{'coworkers', 'share', 'connect', 'file'}"
post020,,1,{'device'},My laptop connects to Wi-Fi but I can’t see or access shared folders on the network.,access share folders share folders network connect wifi access,"{'access', 'folders', 'wifi', 'network', 'connect', 'share'}"
post021,,0,set(),"Internet access only works via Ethernet, not Wi-Fi",access work ethernet,"{'work', 'access', 'ethernet'}"
post021,,1,set(),"I can get online when plugged in via cable, but Wi-Fi shows connected without internet.",cable wifi connect online plug cable connect internet,"{'cable', 'wifi', 'plug', 'internet', 'online', 'connect'}"
post022,,0,{'network_concept'},High latency and packet loss during online gaming,high latency packet latency packet loss packet loss online,"{'high', 'packet', 'latency', 'online', 'loss'}"
post022,,1,set(),I get random lag spikes and sometimes get disconnected.,lag spike disconnect random lag spike,"{'random', 'spike', 'disconnect', 'lag'}"
post023,,0,{'malware'},Corporate email not syncing on mobile,corporate email sync email sync mobile,"{'corporate', 'sync', 'email', 'mobile'}"
post023,,1,{'protocol'},My phone won’t sync corporate emails unless I’m on VPN.,sync corporate email im vpn wont sync corporate,"{'wont', 'corporate', 'sync', 'email', 'vpn', 'im'}"
post024,,0,set(),Wi-Fi drops whenever microwave is on,wifi drop microwave,"{'wifi', 'drop', 'microwave'}"
post024,,1,set(),"Whenever I use the microwave, Wi-Fi speeds drop or disconnect.",speed drop disconnect microwave wifi speed,"{'wifi', 'microwave', 'disconnect', 'speed', 'drop'}"
post025,,0,{'protocol'},VPN connected but slow internet,connect slow internet vpn connect slow,"{'vpn', 'slow', 'connect', 'internet'}"
post025,,1,{'protocol'},"When connected to VPN, my internet speed drops significantly.",connect vpn internet internet speed drop,"{'internet', 'speed', 'drop', 'connect', 'vpn'}"
post026,,0,{'device'},Can't print to network printer over Wi-Fi,print network printer,"{'network', 'print', 'printer'}"
post026,,1,{'device'},My laptop can’t find the network printer unless I’m connected via Ethernet.,laptop network printer connect ethernet,"{'network', 'printer', 'connect', 'laptop', 'ethernet'}"
post027,,0,set(),Can't access online exams portal from dorm Wi-Fi,exams portal dorm portal dorm wifi online exams portal access online exams,"{'access', 'wifi', 'portal', 'online', 'exams', 'dorm'}"
post027,,1,set(),"The portal doesn't load, but other sites are fine.",portal doesnt load doesnt load sit,"{'sit', 'portal', 'doesnt', 'load'}"
post028,,0,{'person'},Slow Wi-Fi after adding new smart devices,slow wifi add new smart devices,"{'slow', 'new', 'wifi', 'smart', 'add', 'devices'}"
post028,,1,set(),"Ever since I added new smart bulbs and cameras, my Wi-Fi has become slow.",bulbs cameras wifi smart bulbs cameras cameras wifi slow,"{'slow', 'wifi', 'bulbs', 'smart', 'cameras'}"
post029,,0,{'protocol'},Can’t connect to VPN from coffee shop Wi-Fi,connect vpn coffee coffee shop wifi,"{'shop', 'coffee', 'wifi', 'connect', 'vpn'}"
post029,,1,{'protocol'},"Public Wi-Fi blocks VPN connections, any workarounds?",block vpn connections vpn connections workarounds public wifi block,"{'wifi', 'connections', 'workarounds', 'public', 'vpn', 'block'}"
post030,,0,set(),Wi-Fi signal strong but video calls lag,signal strong video,"{'signal', 'strong', 'video'}"
post030,,1,set(),Signal shows full bars but video conferences freeze and audio cuts out.,conferences freeze audio bar video conferences video conferences freeze,"{'bar', 'audio', 'freeze', 'video', 'conferences'}"
post037,,0,set(),Ethernet shows connected but no internet access,ethernet connect internet connect internet access,"{'access', 'connect', 'internet', 'ethernet'}"
post037,,1,set(),"Windows says I'm connected via Ethernet, but there's no internet. Wi-Fi works fine on the same network. Tried disabling/enabling the adapter — no luck.",network try disablingenabling internet wifi work im connect ethernet,"{'wifi', 'network', 'internet', 'try', 'connect', 'disablingenabling', 'work', 'im', 'ethernet'}"
post038,,0,"{'time', 'cardinal', 'tool'}",Ping spikes every 30 seconds on Windows 11,ping spike 30 spike 30 second 30 second windows,"{'windows', 'second', 'ping', 'spike', '30'}"
post038,,1,"{'time', 'tool'}",Every 30–40 seconds I get a ping spike in online games. Task Manager shows 'Service Host: Network Service' spiking at the same time.,network service spike ping spike online,"{'network', 'service', 'online', 'ping', 'spike'}"
post039,,0,{'protocol'},VPN disconnects Wi-Fi access to everything else,disconnect wifi access vpn disconnect wifi,"{'wifi', 'access', 'vpn', 'disconnect'}"
post039,,1,{'protocol'},"As soon as I connect to my company’s VPN, I lose access to all other internet — can’t browse, use Teams, etc.",connect company vpn vpn lose access company vpn lose,"{'access', 'company', 'lose', 'connect', 'vpn'}"
post040,,0,set(),Upload speeds fine in browser but OBS keeps disconnecting,upload speed fine browser obs disconnect,"{'fine', 'obs', 'browser', 'upload', 'speed', 'disconnect'}"
post040,,1,"{'time', 'product', 'cardinal'}",Speedtest shows 20Mbps upload but OBS drops to 0 and disconnects every few minutes. On Windows 10 with wired Ethernet.,speedtest 20mbps upload,"{'speedtest', '20mbps', 'upload'}"
post041,,0,set(),"Cannot access specific website on Windows PC, works on phone",pc work phone specific website windows,"{'windows', 'specific', 'website', 'pc', 'work', 'phone'}"
post041,,1,"{'device', 'cardinal'}","One site just won’t load on my Windows desktop (ERR_CONNECTION_TIMED_OUT), but works fine on my phone on the same network.",windows desktop err_connection_timed_out,"{'windows', 'err_connection_timed_out', 'desktop'}"
post042,,0,set(),Multiple network profiles causing weird behavior,multiple network profile network profile cause,"{'profile', 'network', 'multiple', 'cause'}"
post042,,1,set(),"My PC shows 'Network 2', 'Network 3', etc. in the adapter list and sometimes apps won't connect unless I reset the adapter.",network network adapter apps wont connect,"{'wont', 'apps', 'network', 'connect', 'adapter'}"
post043,,0,set(),Proxy settings reset after every reboot,settings reset reboot,"{'reboot', 'reset', 'settings'}"
post043,,1,set(),"Even when I disable the proxy in Windows settings, it re-enables itself after a restart. Super annoying.",proxy windows settings restart super annoy disable proxy windows settings reenables restart,"{'windows', 'restart', 'reenables', 'proxy', 'disable', 'annoy', 'super', 'settings'}"
post044,,0,set(),"Wi-Fi connects but says 'No Internet, secured'",say internet secure connect say internet,"{'connect', 'say', 'internet', 'secure'}"
post044,,1,set(),"Windows connects to the school Wi-Fi but always says 'No Internet, secured'. Other students don’t have this issue.",windows connect school internet secure students connect school wifi,"{'windows', 'secure', 'wifi', 'internet', 'school', 'connect', 'students'}"
post045,,0,set(),"Google Drive sync not working on Windows, works on web",google drive sync sync work windows,"{'windows', 'drive', 'google', 'sync', 'work'}"
post045,,1,{'device'},Drive for Desktop says 'No connection' but I can use the web version fine. This started after a Windows update.,start windows update web version fine desktop say connection,"{'windows', 'fine', 'desktop', 'connection', 'web', 'start', 'version', 'say', 'update'}"
post046,,0,set(),Network adapter disappears after sleep mode,network adapter disappear adapter disappear sleep disappear sleep mode,"{'network', 'disappear', 'mode', 'sleep', 'adapter'}"
post046,,1,set(),"After waking from sleep, my Wi-Fi adapter is just gone from Device Manager. Only a restart brings it back.",sleep wifi adapter adapter device manager,"{'wifi', 'manager', 'sleep', 'adapter', 'device'}"
post047,,0,{'person'},Hotel Wi-Fi connects but no browsing possible,wifi connect browse hotel wifi connect connect browse possible,"{'wifi', 'possible', 'connect', 'browse', 'hotel'}"
post047,,1,{'device'},"My laptop connects to the hotel Wi-Fi network, but I can't load any websites or use apps that require internet. Other guests say their devices work fine.",laptop connect hotel connect hotel wifi apps require internet,"{'apps', 'wifi', 'internet', 'connect', 'hotel', 'laptop', 'require'}"
post048,,0,{'protocol'},VPN connection established but internal resources unreachable,vpn connection establish internal resources unreachable,"{'connection', 'internal', 'resources', 'unreachable', 'vpn', 'establish'}"
post048,,1,{'protocol'},"VPN status shows connected, but I can’t access our dev servers or internal tools. My internet works fine otherwise.",vpn status connect connect access dev internal tool internet,"{'tool', 'access', 'internal', 'internet', 'dev', 'connect', 'status', 'vpn'}"
post049,,0,set(),Wi-Fi signal drops when moving between rooms,signal drop room,"{'signal', 'drop', 'room'}"
post049,,1,set(),"When I move from my living room to the bedroom, the Wi-Fi signal drops dramatically or disconnects completely.",signal drop dramatically bedroom wifi signal,"{'signal', 'bedroom', 'wifi', 'drop', 'dramatically'}"
post050,,0,{'tool'},Certain websites won’t load even though ping is good,certain websites wont websites wont load load ping good,"{'wont', 'good', 'websites', 'certain', 'load', 'ping'}"
post050,,1,"{'domain', 'tool'}","I can ping websites like google.com fine, but some specific sites or services time out or never load.",ping websites like service time load,"{'websites', 'like', 'service', 'load', 'ping', 'time'}"
post051,,0,set(),Wi-Fi shows connected but no internet on my gaming PC,connect internet game,"{'connect', 'internet', 'game'}"
post051,,1,set(),My PC is connected to Wi-Fi but can’t access the internet. Other devices on the same network are fine.,access internet devices connect wifi access devices network fine wifi access internet,"{'fine', 'access', 'wifi', 'network', 'internet', 'devices', 'connect'}"
post052,,0,{'protocol'},VPN disconnects during video meetings,disconnect video meetings,"{'video', 'disconnect', 'meetings'}"
post052,,1,"{'protocol', 'time'}","While on Zoom calls, my VPN connection drops after about 10 minutes, causing interruptions.",vpn connection drop zoom vpn connection,"{'zoom', 'drop', 'connection', 'vpn'}"
post053,,0,{'device'},Laptop internet slow but phones are fine,laptop internet slow internet slow phone,"{'slow', 'laptop', 'internet', 'phone'}"
post053,,1,{'device'},My laptop's internet speed is very slow compared to my phone on the same Wi-Fi network.,laptops internet speed compare phone wifi,"{'laptops', 'wifi', 'internet', 'speed', 'compare', 'phone'}"
post054,,0,"{'device', 'tool'}","Ping to router works, but no internet access",router work internet,"{'work', 'internet', 'router'}"
post054,,1,"{'device', 'tool'}",I can ping my router’s IP address but can’t load any websites or services.,routers ip address load websites service,"{'websites', 'service', 'routers', 'address', 'load', 'ip'}"
post055,,0,{'time'},Slow internet only during evening hours,slow internet hours,"{'slow', 'hours', 'internet'}"
post055,,1,"{'time', 'date'}",Internet speed tanks every evening around 7 PM but is fine during the day.,internet speed tank speed tank pm,"{'pm', 'tank', 'internet', 'speed'}"
post056,,0,{'gpe'},Wi-Fi signal is full bars but files won’t download,signal bar file file wont download,"{'signal', 'wont', 'bar', 'download', 'file'}"
post056,,1,{'device'},"My laptop shows a strong Wi-Fi signal, but large files hang or fail to download.",strong wifi signal hang fail download large file hang laptop strong wifi,"{'signal', 'strong', 'wifi', 'hang', 'fail', 'large', 'laptop', 'download', 'file'}"
post057,,0,{'person'},Hotel Wi-Fi requires login but login page won’t load,hotel wifi require login login page,"{'wifi', 'login', 'hotel', 'page', 'require'}"
post057,,1,set(),"I connect to the hotel Wi-Fi, but the captive portal login page never appears, so I can’t get online.",captive portal login wifi captive portal connect hotel wifi,"{'captive', 'wifi', 'login', 'portal', 'connect', 'hotel'}"
post058,,0,{'protocol'},VPN connects but slow internet speeds,connect slow internet vpn connect slow,"{'vpn', 'slow', 'connect', 'internet'}"
post058,,1,{'protocol'},"My VPN connects successfully, but my internet speed drops to almost unusable levels.",successfully internet speed vpn connect successfully speed drop unusable,"{'unusable', 'successfully', 'internet', 'speed', 'drop', 'connect', 'vpn'}"
post059,,0,{'tool'},High ping spikes despite stable Wi-Fi,ping spike despite high ping spike despite stable wifi,"{'high', 'despite', 'wifi', 'stable', 'ping', 'spike'}"
post059,,1,"{'time', 'tool'}","My Wi-Fi signal is stable and strong, but my ping in online games randomly spikes every few minutes.",wifi signal stable stable strong ping strong ping online,"{'signal', 'strong', 'wifi', 'stable', 'online', 'ping'}"
post060,,0,"{'protocol', 'device'}",VPN disconnects when laptop sleeps,disconnect laptop sleep,"{'sleep', 'laptop', 'disconnect'}"
post060,,1,"{'protocol', 'device'}","Whenever my laptop goes to sleep, the VPN disconnects and won’t reconnect automatically when I wake it.",sleep vpn disconnect reconnect automatically wake,"{'automatically', 'disconnect', 'reconnect', 'sleep', 'vpn', 'wake'}"
post061,,0,set(),Wi-Fi connected but can’t stream videos,connect stream videos,"{'videos', 'stream', 'connect'}"
post061,,1,"{'product', 'gpe'}","My device shows connected to Wi-Fi, but YouTube and Netflix videos won’t load or buffer endlessly.",youtube netflix videos connect wifi youtube,"{'wifi', 'netflix', 'videos', 'connect', 'youtube'}"
post062,,0,{'protocol'},Can’t access company intranet over VPN,access company intranet company intranet vpn,"{'intranet', 'access', 'vpn', 'company'}"
post062,,1,{'protocol'},"VPN connects fine, but I can’t reach our company intranet or internal websites.",vpn connect fine company intranet internal,"{'fine', 'internal', 'company', 'connect', 'vpn', 'intranet'}"
post063,,0,{'device'},Wi-Fi frequently disconnects on Windows laptop,frequently disconnect windows,"{'windows', 'disconnect', 'frequently'}"
post063,,1,{'device'},My Windows laptop keeps disconnecting from Wi-Fi randomly even though signal is strong.,disconnect wifi randomly windows laptop disconnect,"{'windows', 'randomly', 'wifi', 'disconnect', 'laptop'}"
post064,,0,{'person'},Hotel Wi-Fi limits device connections,wifi limit device limit device connections hotel wifi limit,"{'wifi', 'connections', 'limit', 'hotel', 'device'}"
post064,,1,"{'device', 'cardinal', 'person'}",Hotel Wi-Fi only allows one device connection per room; I want to connect my phone and laptop simultaneously.,hotel wifi allow phone laptop simultaneously,"{'wifi', 'phone', 'simultaneously', 'allow', 'hotel', 'laptop'}"
post065,,0,{'protocol'},VPN slows down file transfers drastically,slow file transfer vpn slow file file transfer drastically,"{'slow', 'drastically', 'transfer', 'vpn', 'file'}"
post065,,1,{'protocol'},File transfers over VPN take much longer than over my normal internet connection without VPN.,transfer vpn longer,"{'longer', 'transfer', 'vpn'}"
post066,,0,set(),Wi-Fi connects but can’t get IP address,connect ip address,"{'ip', 'connect', 'address'}"
post066,,1,set(),My device connects to Wi-Fi but shows ‘No IP address’ and can’t access the internet.,device connect wifi wifi ip address address access internet,"{'access', 'wifi', 'internet', 'connect', 'address', 'ip', 'device'}"
post067,,0,{'person'},Hotel Wi-Fi asks for payment after free trial,wifi ask payment hotel wifi ask ask payment free payment free trial,"{'payment', 'wifi', 'trial', 'ask', 'hotel', 'free'}"
post067,,1,set(),"I connected to hotel Wi-Fi that initially was free, but now it suddenly asks me to pay to continue using it.",hotel wifi initially,"{'initially', 'wifi', 'hotel'}"
post068,,0,{'protocol'},VPN connected but games show location mismatch,connect game location game location mismatch,"{'mismatch', 'connect', 'game', 'location'}"
post068,,1,{'protocol'},"I use a VPN, but some games detect my real location and block me from playing.",vpn game detect location block play,"{'location', 'game', 'play', 'vpn', 'block', 'detect'}"
post069,,0,set(),Wi-Fi connected but very slow on some devices,connect slow devices,"{'slow', 'devices', 'connect'}"
post069,,1,{'device'},"Some of my devices have fast Wi-Fi, but others are slow or keep buffering even near the router.",wifi slow buffer devices fast wifi buffer near router,"{'fast', 'slow', 'router', 'wifi', 'near', 'devices', 'buffer'}"
post070,,0,{'protocol'},VPN drops connection during video calls,drop connection video vpn drop connection,"{'video', 'drop', 'connection', 'vpn'}"
post070,,1,{'protocol'},"While on VPN, my video calls frequently drop or freeze randomly.",video frequently drop frequently drop freeze,"{'video', 'drop', 'freeze', 'frequently'}"
post071,,0,set(),Buffering issues despite strong Wi-Fi signal,despite strong wifi strong wifi signal buffer issue despite,"{'signal', 'despite', 'strong', 'wifi', 'issue', 'buffer'}"
post071,,1,set(),"My Wi-Fi shows full bars, but streaming videos keep buffering or drop quality suddenly.",bar stream videos stream videos buffer wifi bar stream,"{'bar', 'wifi', 'videos', 'stream', 'buffer'}"
post072,,0,{'protocol'},VPN connects but company resources inaccessible,connect company resources company resources inaccessible vpn connect company,"{'inaccessible', 'company', 'resources', 'connect', 'vpn'}"
post072,,1,{'protocol'},My VPN shows connected but I can’t access internal files or apps from work.,connect access internal vpn connect access,"{'vpn', 'internal', 'connect', 'access'}"
post073,,0,"{'protocol', 'tool'}",Games lag despite low ping on VPN,despite low ping low ping vpn game lag despite,"{'despite', 'game', 'lag', 'low', 'ping', 'vpn'}"
post073,,1,"{'protocol', 'tool'}","I use VPN and get low ping, but gameplay is still laggy and input delays happen.",gameplay laggy input low ping gameplay ping gameplay laggy,"{'low', 'laggy', 'input', 'ping', 'gameplay'}"
post074,,0,"{'time', 'person'}",Hotel Wi-Fi disconnects after a few minutes,wifi disconnect minutes hotel wifi disconnect,"{'wifi', 'hotel', 'minutes', 'disconnect'}"
post074,,1,set(),"Every time I connect to hotel Wi-Fi, it disconnects after a short time, forcing me to reconnect.",disconnect short time force reconnect,"{'disconnect', 'reconnect', 'force', 'time', 'short'}"
post075,,0,{'protocol'},VPN slows down internet despite fast local Wi-Fi,slow internet despite vpn slow internet fast local wifi,"{'fast', 'slow', 'despite', 'wifi', 'internet', 'local', 'vpn'}"
